{
  "artifact_id": "graph-projection.export",
  "artifact_type": "graph_projection",
  "source": {
    "document_id": "synthetic-reference-guide",
    "capture_mode": "static-fixtures",
    "source_commit": "ad1febe626fd96afff414bf5c425b4a672213a14",
    "fixture_path": "fixtures/graph-reranker.synthetic.json"
  },
  "redaction_status": "passed",
  "projection": {
    "status": "partial_by_quality_policy",
    "nodes_projected": [
      {
        "node_id": "ref-srg-001",
        "label": "ReferenceUnit",
        "display_reference": "Synthetic Book 1, Unit 1"
      },
      {
        "node_id": "ref-srg-002",
        "label": "ReferenceUnit",
        "display_reference": "Synthetic Book 1, Unit 2"
      }
    ],
    "nodes_blocked": [
      {
        "node_id": "ref-srg-003",
        "label": "ReferenceUnit",
        "display_reference": "Synthetic Book 1, Unit 3",
        "reason": "parser_quality_blocked",
        "quality_flags": [
          "parser_quality_block:reference_unit_missing_expected_script"
        ]
      }
    ],
    "relationships": [
      {
        "from": "ref-srg-001",
        "to": "ref-srg-002",
        "type": "FOLLOWS"
      }
    ]
  },
  "limitations": [
    "Graph projection is synthetic and small.",
    "Blocked projection state is included to prove quality policy visibility, not graph completeness."
  ]
}
